comment,date,score,user,title
이성계를 보면 구국의 혁명을 일으키신 박정희님이 생각납니다 ㅠㅠ정도전을 보면 따끔한 말도 서슴지 않던 노무현님이 생각납니다 ㅠㅠ,2014-02-09,10.0,윤번돌이,63553
밥 벌어지 ㅋㅋㅋ,2014-02-11,10.0,소녀여,63553
유동근아저씨 보면서 프로라는 생각이 드네요. 그 두꺼운 갑옷과 퍼를 두르시고도 그렇게 큰 몸짓으로 칼 휘두르시는 거 보면 진짜 프로는 프로입니다. 짱 멋잇어요,2014-02-11,10.0,송송파파,63553
"내 한 마디만 하겟소, "" 죽지 말라우 """,2014-02-11,10.0,제로스,63553
쵝오!!!!!!!!!!! 흥미진진합니다. 조재현 연기 좋아요~,2014-02-11,10.0,아랑,63553
뭐하나 빠지는게 없네..최고입니다 정말 잘보고있습니다. 배역들이 어찌이리 어울리는지 감탄하고 봅니다,2014-02-11,10.0,zzamky,63553
미달이 아부지의 연기력ㄷㄷ사극에서 박영규님을 계속봤으면~암튼 배우들의 캐릭터들이 전부 살아숨쉬는듯 연기들이 쩔어요ㅋ,2014-02-10,10.0,공갈덕,63553
최고!! 김명수씨 박영규씨 이덕희씨 유동근씨 서인석씨연기의 달인들이십니다 진정,2014-02-10,10.0,tapout,63553
이건 하나의 예술그자체다. 1~2회때 공민왕 김명수씨의 카리스마부터 시작해서 조재현 유동근 그리고 다른 수많은 배우한명한명이 절대 카리스마다. 용의눈물이후로 이런대작은 처음본다,2014-02-10,10.0,Rkqnfausghsska,63553
이성계의 뿌리가 여진족이라니 ...되도록 사실적으로 묘사한다 했으니 ...,2014-02-10,8.0,몬내,63553
너무나 재미있게 보고있다 너무나 흥미진진하다.,2014-02-10,10.0,giva1234,63553
화룡점정인 조재현.. 뼛속까지 그자체인 예술.. 맨날 궁중 여자들 싸움 탁상공론권력싸움 역사 드라마만 있다가 이드람을 보니 ..  우리나라에도 이런 사람들이 있었구나 하게된다 ..정도전은 많은 지식으로 조선의 법치국가로서의 기초를 만들었고  말뿐 아니라  행동으로  일치했으며 서양의 실용주의 정신도 가진 훌륭한,2014-02-10,9.0,han woo jin,63553
몇 회 나오는 조연도 연기가 다르다.전투장면도 서사시를 보듯 훌륭하다,2014-02-10,10.0,섬에서본별,63553
아 진짜 너무 재미있다!,2014-02-10,10.0,고냥,63553
사극의 경지가 느껴진다.,2014-02-09,10.0,섬광처럼,63553
역시 멋진 사극 명장들의 연기 리얼 감동 제데로다.,2014-02-09,10.0,dudaos,63553
오랜만에 나온 제대로 된 사극,2014-02-09,10.0,가을하늘,63553
와.. 어제 전쟁씬 퀄리티 ㅎㄷㄷㄷ 난 무슨 영화 한장면보는줄알았음...특히 밤 전투씬은 최고라고 생각함....정도전보다 이성계 캐릭터가 더 좋네요 ^^**,2014-02-09,10.0,황해,63553
"이성계, 이방원, 승자의 입장에서 기록해 놓은것을 그대로 인용한것으로 판단됨.패자입장에서도 생각했어야하는 아쉬움이 진하게 남는군.",2014-02-09,10.0,김도언,63553
수신료인상이 공정방송의 시작이라고 대놓고 광고하드만?정도전 이것도 수신료인상안만 통과되면 바로 광개토처럼 흐지부지 드라마 되는겨~,2014-02-09,6.0,아이언우먼,63553
사극은 역시 kbs 대하드라마인듯..솔까말 정도전 11화 전투씬 역대 최고급_멋졋어,2014-02-09,10.0,meturakzi,63553
11화는 역대급 전투씬이었음.,2014-02-09,10.0,굿몰링,63553
환장하게 재밌습니다 추운데 고생하시는 스태프 배우자 모두 힘내주세요,2014-02-09,10.0,규토사랑,63553
"추운 겨울에 멋진 장면 만드신다고 모든 배우와 스태프들 다 고생하셨습니다. 보고 즐길 거리도 있고, 뭔가를 생각하게 만드는 정통사극 입니다.",2014-02-09,10.0,DKim,63553
꿀잼,2014-02-08,10.0,ㅓㅈㅇ라래ㅏㅂㅈㄼㄷㅈㄼ,63553
"드라마정도전!
잘!시청하고있습니다..
아직도.!갈길이.먼길..
초심을.잊지마시고서.끝까지.정도로.나아갔으면합니다.
그리고.드라마종료시.매회마다.역사유적지탐방은.
정말!좋습니다..수신료에가치를..잊지마시길부탁드립니다
그럼!이번주..주말밤을.누구보다더!기다리는시청자에한사람
응원을.하면서.
화이팅!",2014-02-05,8.0,계명산천,63553
"아우, 명품냄새. 다 좋지만 조명 정말 잘쓰는것같다. 적절한 어둠이 참 매력적이야.",2014-02-10,10.0,맛살,63553
말이 필요 없다,2014-02-10,10.0,농구신동지훈,63553
정통사극...  간만에  좋습니다,2014-02-08,10.0,icetea,63553
깝깝한 이조시대를 만드는대 공헌을 한 정도전은 ... 아무리 미화해도 .. 답이안나온다 ..이성계는 그냥 조폭두목이나 할만한 인물 ..깝깝한 암흑기 ..고조선 고려 그많은 자랑스런 역사를... 다 깨버린 ..참으로 안타까운 우리의 역사...,2014-02-07,0.0,나우누리,63553
",연기력 가볍고 대사또한 가벼워, 하나를 얻는것이 아닌, 하나를 빼앗기는 느낌, 대체, 연출자가 누구심...?????",2014-02-07,1.0,필립,63553
요거슨고려말 조선 초 시대의 무협이여... 그랑께 조선판 무협을 동화상으로 맹근 거시여..간신배들은 모두 이 시대애도 기생하고 이땅깨로...,2014-02-06,9.0,금강초롱,63553
"애국자가 따로 있습니까..한국 드라마 역사 드라마 국민들에게 잘 전달 하는 사람이 지금의 애국자 이네여... 작가님,, 연출자님 해외에서도 잘 보고 있으니 분발해 주세요...",2014-02-05,9.0,다레다레,63553
정도전도 산전수전 공중전까지 장난 아니었구나 ㅋㅋ,2014-02-04,10.0,주완아빠,63553
아주최고 잘보고있습니다.,2014-02-04,10.0,giva1234,63553
별로......,2014-02-04,3.0,hilee,63553
그래 떼놈은 중국어하고 왜놈은 일본어 써야지! 이게 진짜 불멸에서 아쉬운 점이었는데 아무튼 정도전 짜응♥♥,2014-02-03,10.0,JKJ,63553
간만에 보는 정통사극. 연기도 연출도 무게감이 있음!,2014-02-03,10.0,톨렝이누나,63553
굳,2014-02-03,10.0,00000,63553
시청료  인상은 반대다..네들 월급부터 좀 내려야....,2014-02-03,7.0,노만필,63553
"재밌게 보고 있긴 하다만, 사극의 타이틀롤을 맡기에 조재현은 좀 가늘다는 느낌이다. 글고 아무리 야외세트촬영이라지만 실내에선 난로를 피우던지해서 배우들 입김 좀 없애라. 스산함이 뼈속까지 스며들더라.",2014-02-03,9.0,ㅈㅇㅎㄷㅇㅎㅇ,63553
교훈을 얻고 향기를 느낄 수 있는 드라마,2014-02-03,10.0,푸하,63553
오랜만에 제대로 된 사극이구만,2014-02-03,10.0,형우맘,63553
이인임을 보며 지금 정치인들이 떠오르는 이유는 ??  심리전 긴장감을 잘 잡아 주는 연출력 명성황후 드라마 때 유동근과 이미연의 심리전 연출을 보는 느낌이랄까!! 뭔가 조금 덜 채워진 것 같은 아쉬움은 남지만!!  요즘 아주 재밌게 보고 있습니다.,2014-02-03,9.0,우리땅독도,63553
"모처럼 kbs가 제대로된 사극 내놓아 기분좋게 보고있다.. 모든 사극들이 코믹을 가미해 식상했었고 드라마는 막장들 투성이라 짜증났었는데, 웃음기빼고 몰입해볼수있는 역사물 좋다..어느쪽으로 작가의 관점만 기울지않았으면 하는 바람이다.",2014-02-03,9.0,dla,63553
연기도 못하는 수꼴 색퀴가 주연이라니 원 ㅡㅡ,2014-02-03,0.0,라라라,63553
"아...놀랍다. 전쟁장면 보았나? 점점 발전 해 나가는 구나. 정치드라마라고 해도 나중에 있을 위화도 회군과, 개성전투 씬은 좀더 공들여 큰 스캐일로나왔으면 하네요. 아주 ㄳ하게 잘봅니다 .",2014-02-03,10.0,인생을즐겁게,63553
이런게 진짜 역사입니다. 시청률 때문에 역사를 조작하는 드라마가 아닌 우리 아이들에게 진실된 역사를 보여주는 드라마가 되길 바랍니다. 진포대첩에 대해 새롭게 알게 되었습니다.,2014-02-02,10.0,옳은나무,63553
재미있긴한데 너무 방송 시간이 적음  좀더 늘었으면 하는 기분이,2014-02-02,10.0,가을남자,63553
간만에 본방 사수하면서 보고있는 드라마.,2014-02-02,10.0,호돌이,63553
박수무당 지가 죽고 지랄이야ㅋ남의팔자 봐줄생각말고 지 팔자나 볼 것이지.,2014-02-02,8.0,우경,63553
조재현은 영~.. 선굵은 연기의 대가 김흥기 선생님의 연기를 다시 보고 싶다. 살아계셨더라면 얼마나 좋았을꼬...,2014-02-02,7.0,rosebud,63553
너무 재미 있습니다.  역사적으로도 우리 나라 사대부의 시초를 볼 수 있어 의미 있네요~~역사란 그런 겄이 초기에는 잘 하다가 갈 수록 이상해지지요~~ 요즘 사대부들이 챙겨 보고 초심을 다시 한번 느꼈으면 합니다.,2014-02-02,10.0,오명자,63553
정말 재밌게 잘보고있습니다. 다른 분들 연기도 두말할것없이 대단하지만 특히나 명덕태후역을 맡으신 이덕희님 날카로운 연기 정말 대단하네요..,2014-01-31,10.0,up to me,63553
잘 보고있어요. 응원합니다~!,2014-01-30,10.0,daywalker,63553
"용의눈물에서 유동근씨포스 대단했었는데 이방원이 아닌 이성계로 돌아왔군요 존재감 엄청납니다  ""권문세가vs신진사대부""  시작되는건가요이성계,최영,이인임  ... 역할에 정도전 존재감이 약해보입니다오랜만에 사극다운 사극 보는것같습니다 앞으로 진행되어질 전개가 기대됩니다",2014-01-25,10.0,하얀나비,63553
박영규가 하는 역활 너무 마음에 안들어  이인임 너무 치사하고 용심이 너무 하다 진짜 심하다 이인임 죽어라 이인님은 뿌우우우우 죽어도 돼 정도전은 재미가 있어 이인임은 사라져도 돼 이인임이 무너져야지 고소해,2014-01-25,7.0,kllara,63553
"그 당시 정도전은 고려 권문세족이 원나라에 기댄다고 하면서, 신진사대부들은 명나라에게 기댄거랑 별반 다를게 없더라구요..그러면서 자기네가 무슨 청렴한듯한..서로 똑같은 정치인들인데사실 정도전이란 인물에게 그다지호감은 안가네요",2014-01-25,6.0,外柔內剛,63553
내용을 알고 보는 드라마의 경우 얼만큼 극적으로 표현해내느냐의 문제인데.. 앞으로가 문제같음..,2014-01-25,8.0,현실타파,63553
볼만 하네요.,2014-01-25,5.0,Lucky,63553
오랜만에 정통사극을 보게 되네요..,2014-01-30,10.0,clint99,63553
이성계에게 정도전이 있었다면 전두환에겐 장세동이 있었다.,2014-01-29,10.0,말자지라방송,63553
이 시대의 국민정신은 썩지 않았나 쉽구려..국가는 절대로 부속품이 아닙니다..국민믄 국가를 부속품으로 생각하네요..내 일생 조국과 민족을 위해해..태양은 하늘이 두렵지 않습니다..하늘이 태양을 두려할뿐..,2014-01-28,10.0,정종현,63553
썩을대로 썩은 고려의 개혁세력의 쌍두마차이자 막역지우인 정도전과 정몽주가 끝까지 힘을 합쳤더라면 ㅋㅋ 결국 이방원의 어부지리인가 ㅋㅋ 글구 이인임의 대사가 아주 걸작입니다 ㅋㅋ,2014-01-28,10.0,주완아빠,63553
오랫만에 정통사극을 보는것 같아요~,2014-01-27,9.0,깜시,63553
지난 토요일에 케이블에서 하는 재방송 보다 완전 재밌어 본방까지 쭉 사수했습니다. 넘 재밌습니다. 정치에서 기득권을 가진 세력에 대항하는 것이 얼마나 힘든 일인지 생생하게 느껴졌습니다.,2014-01-27,10.0,친구야,63553
ㅋㅋ,2014-01-27,10.0,김도권,63553
영화같이 디테일하다,2014-01-27,10.0,웨하스의자,63553
"옥의  티..
정도전 마누라~~",2014-01-27,10.0,이안,63553
재밌어요.,2014-01-26,10.0,조카세요,63553
간만에 볼만한 정통사극 잘보고 있습니다.,2014-01-26,8.0,jys,63553
요점은 정도전이나 이성계 우상화가 아니라 시대고발이란 거 명심해 주길~,2014-01-26,8.0,Terry,63553
개인적으로 난 별루......,2014-01-24,2.0,hilee,63553
"이제야 볼만한 사극이 나왔네요. 용의눈물, 대장금이후로~",2014-01-23,9.0,테리쳐,63553
최고의 드라마! 그런데 다음은 최신 회차가 5회라니..뭐지?,2014-01-21,10.0,매너남,63553
정말 재미있어요 ^^,2014-01-21,10.0,침묵자,63553
정도전의 부인은 개그 그만 하시게!,2014-01-21,0.0,말할수없는비밀,63553
용의 눈물 이후 드라마 다운 사극드라마를 보게.됐네요,2014-01-20,9.0,신률,63553
태조왕건 이후 로 재밌게 보는 대하드라마,2014-01-19,10.0,달빛창공,63553
불멸의 이순신 이후로 재밌게 보는 드라마,2014-01-19,10.0,ㅓㅈㅇ라래ㅏㅂㅈㄼㄷㅈㄼ,63553
"궁금하였던, 고려말과 조선초의 과도기의 실증정 사실에 
 제대로 된 역사드라마인것 같아요.",2014-01-19,9.0,김종명,63553
저도 오랜만에 드라마 챙겨보게 되었네요. 고퀄리티 드라마 잘 보고있습니다 ^^ 오랜만에 보는 배우들이 많아서 반갑네요.,2014-01-19,10.0,사랑이,63553
아이돌이나 가수 아님 얼굴로 먹고 사는 탤런트 주연이 대부분인게 요즘 드라마라서 드라마란걸 안본지가 상당히 오래되었는데 올만에 진지하게 몰입할수 있는 드라마가 나와서 참 좋아요 지지하는 국민들이 많은데 심혈을 기울여서 품격높은 드라마 만들어주시길..,2014-01-19,10.0,tropical fruit,63553
간만에 사극다운 사극을 본상사수하고 있다... 연기도 잘들 하고... ㄳㄳ...,2014-01-19,10.0,태막리지연개소문,63553
"오랜만에 드라마 챙겨볼 수 있겠네,,배우, 역사적 배경 만으로 10점.",2014-01-19,10.0,richmind,63553
......,2014-01-19,1.0,2mb ssi bal nom,63553
아역 시절을 안거치고 바로 방송해서 잼있음,2014-01-19,9.0,명왕성,63553
"제가 보는 드라마는 이거 하나인데, 재미있게 보고는 있지만, 이전 사극에 나왔던 배우들이 너무 많이 나오는거 같아 신선함이 없네요...연기도 잘 하지만, 광개토태왕이나 근초고왕, 대왕의 꿈 보고 있나? 생각됩니다...같은 배우의 분장도 이미지가 너무 비슷해서...",2014-01-13,9.0,아딸딸,63553
초등두아이엄마예요.아이들덕분에 역사공부를 시작했는데 지금 고려말에서 초선초기부문읽어가고 잇ㄴ는데..역사를 알고 이 드라마를 보니 인물들의 사건과 배경이 그려지며 너~~무 즐겁게 보고있어요.그냥보는재미도 있지만 가족과 함께 책도 함께 읽고 드라마 속 인물과 비교해가며 보는 재미는 두배랍니다.,2014-01-13,10.0,웃으면복이와요,63553
"정통 대하사극이라기에 무겁고 지루할 줄 알았는데, 연기와 연출이 뛰어나서 재미있음. 오랜만에 챙겨보는 드라마.",2014-01-26,10.0,wine,63553
발연기하는 아이돌 없어서 볼만함,2014-01-26,10.0,소미정,63553
굿잡,2014-01-26,10.0,anjdu,63553
정말 재밌다정도전은 앞으로도 유배생활이 계속 될테니 존재감은 약할 것 같네요하지만 유배지의 생활을 통해 민초들의 아픔과 그 힘을 충분히 배우게 되겠지요이런 사극을 원했고 또 매우 만족하고 있습니다. 최선을 다해주시길ㅎ,2014-01-26,10.0,명성대빵,63553
정도전 화이팅.,2014-01-13,9.0,jhk85,63553
진짜 사극 잘보고 있습니다,2014-01-13,10.0,신동빈,63553
잘보고있습니다,2014-01-13,8.0,몬내,63553
개굳,2014-01-13,10.0,Inho yi,63553
국민을 위한 나라를 꿈꾸던 위대한 개혁가 정도전....절대군주가 아닌 정도전과 함께 국민을 위한 나라를 꿈꾸던 이성계..... 어떻게 이방원같은놈이 태어났을꼬?,2014-01-13,10.0,난201이다,63553
정도전 조재현 명품 연기력에 채널 고정 집중해서 봅니다,2014-01-12,10.0,tptlpinke,63553
"정말 오랜만에 볼만한 사극이 나왔네요
배우분들 모두 훌륭하고 너무 흥미진진합니다
연기력 덕분에 몰입도가 장난 아니네요",2014-01-12,10.0,Yun,63553
연기란 바로 이런 것.. 사극이야 말로 배우의 연기력을 보여주는 바로미터다.... 정도전... 딱 한편 봤다.. 그 한편이 이 드라마의 가치를 나에게 보여주었다.. 오래만에 느껴보는 드라마에 대한 기대감과 카타르시스를 느꼈다.,2014-01-12,8.0,권정훈,63553
오랜만에 보는 정통사극백성을 하늘이라 생각했던 삼봉의 사상을 알 수 있는 좋은 기회라 생각합니다~,2014-01-12,10.0,처음,63553
선 굵은 사극이 나왔다이렇게 몰입하게 한 사극은 정말 오랜만이다,2014-01-12,9.0,명성대빵,63553
"고증에 철저한 공영방송 kbs 대하 사극변발도 안하는 기황후, 온갖 판타지가 난무하는 판타지 그외 기타 사극정말 오랜만에 좋은사극 나온듯",2014-01-12,10.0,KJK,63553
사극안보는 내가 이렇게 빠지다니 ㅋㅋ,2014-01-11,10.0,한여름밤의 꿈,63553
유동근 서인석  인물 배역이 너무 고루한듯,2014-01-11,7.0,널안다,63553
정말 드라마다운 돈에 치우치지않고 역사드라마입니다   용의눈물 왕과비 이러한드라마가  살아나야합니다 단지 극중주인공인 조재현씨가 연기력이 부족하네요  연기력이 부족하다는표현보다는 사극중에정도전의 인물과는 매치가 안돼서탈이죵,2014-01-19,10.0,jjj,63553
와 난생 처음 36살에 드라마(사극)보고 댓글 달아보긴 처음이네요^^ 아직 5회까진 보지못했지만 스토리가 이렇게 재밌게 잘 이끌어내고 각 배우들이 진정성이 엿보이는 연기력까지 모든 것이 완벽하다고 생각합니다 앞으로도 잘 이끌어 가주시길 바래요^^ 모든 연기자분들 스텝분들 날씨도 추운데 고생하시네요 파이팅~~,2014-01-18,10.0,손현욱,63553
오랜만에 진짜가 나왔다..시청률이 20프로 찍어 줘야할텐데..그리고 나중에 박영규 서인석씨 하차하면 후속 캐스팅 이덕화씨 추천이요..개그적인 감초역할도 제대로고 사극은 이덕화지..ㅋㅋ,2014-01-17,10.0,앗싸,63553
최고의 사극,2014-01-17,10.0,윤홍준,63553
잼나다,2014-01-16,8.0,나사로,63553
김명수씨 연기력 너무 쩔던데요...2회로 하차하시니 많이 아쉽습다. 또 좋은연기 부탁드려요,2014-01-11,10.0,thebest,63553
굿,2014-01-11,10.0,언제나스마일,63553
재밋던데 일단 출연진들 연기를 다 잘함,2014-01-11,10.0,앨리스 모건,63553
오랜만에 정통사극이군요,2014-01-11,10.0,언제나맑음,63553
역사의 정통성을 버리고 오로지 팩션사극 판타지사극 재미와 흥미거리 위주의 사극만 보다가 오랜만에 눈과 귀가 정화되는 드라마입니다 우리가 알고 있는 정도전에 대한 새로운 접근법이나 해석보다는 역사적 사실에 근거한 돌직구 타입의 대하사극이 될 것이라 생각합니다본방사수 하게 될 듯~^^,2014-01-11,8.0,밀리언달러베이비,63553
드라마 정도전 잘 보고있습니다. 대박나길  기원합니다.^^^^^^^,2014-01-16,9.0,이은수,63553
굳굳굳 주말만 기다리고 있습니다. 이번에 유동근씨의 찰진 사투리가 참 인상적이었던 듯 ㅋㅋ^-^,2014-01-15,10.0,이준호,63553
정통 역사드라마의 묵직함이 느껴지네.. 연기들도 모두 좋고...,2014-01-15,10.0,몬,63553
좋아요,2014-01-15,10.0,빠삐코,63553
정치가 다 같은 정치가 아니란 걸 보여 주네요~ 심리묘사 연출 좋습니다.앞으로 기대해 볼게요~~ 기황후에 따끔한 교육좀 시켜주셨으면 합니다.,2014-01-14,9.0,우리땅독도,63553
이제야 간만에 볼 만한 드라마가 나왔습니다!,2014-01-14,10.0,고냥,63553
"케백수 용의눈물,태조왕건 이후로 제대로 된 사극 내놨네..ㅋㅋ 한국드라마 10년만에 본다",2014-01-14,10.0,RATM,63553
정도전 조재현씨 예전부터 좋아했었는데 이번에도 역시 명품 역기 넘 좋네요 ^^,2014-01-13,10.0,솔잎향,63553
역사공부가 되네요...ㅋ,2014-01-13,10.0,Rose,63553
흥미롭고도 유익한 드라마 잘 보고 있습니다.,2014-01-13,10.0,푸하,63553
정도전 화이팅!!,2014-01-13,10.0,gs2430,63553
역시 KBS 만이 할 수 있는 정통 역사드라마의 진수를 보여주고 있다고 생각합니다. 그리고 드라마가 끝난 후에도 여러 사적과 사료를 보여주며 역사의 중요성을 인식하게 하는 점 매우 높게 평가합니다.,2014-01-13,10.0,최병수,63553
배우진도 좋고 스토리도 좋고 재밌게 보고있습니다,2014-01-13,10.0,오바,63553
백발의 최영장군 감명 깊었습니다...고증이나 용어부터 하나하나 세밀한 부분까지 사실적으로 재현해 준다면 역사를 잘 모르는 남녀노소가 역사에 관심을 가질듯 합니다. 제작진 배우진 스텝분들 모두 홧팅~~^^,2014-01-13,10.0,내생에대박,63553
또한편의 한반도스케일 개그콘서트가 출시되었군요.. 이걸 사극이라고해야할지..사극이뭔지 잘 모르겠으면 와신상담부터 보고 드라마를 만드시오,2014-01-10,1.0,말할수없는비밀,63553
오랜만에 재밌는 사극이 나왔네요.^^,2014-01-10,10.0,행복이,63553
너무나 재미있는 정도전 너무나 흥미롭고 재미있는 이야기 너무나 사랑합니다.,2014-01-09,10.0,giva1234,63553
kbs1 대하드라마 챙겨보기는 처음이다 아이돌이랑 성괴들 안나와서 너무 좋다 ㅋㅋㅋㅋㅋㅋㅋㅋ,2014-01-13,10.0,고라파덕,63553
"오랜만에 볼만한 전통 사극 나온 것 같네요! 배우들 연기, 연출 모두 뛰어난 것 같습니다~ 앞으로가 더욱 기대됩니다.",2014-01-08,10.0,DK_JW,63553
전 개인적으로 별로...미안...,2014-01-08,2.0,pearl,63553
요즘 아이돌껴넣어서 말도 안되는 퓨전사극따위를 해서 드라마 자체를 안봤는데.. 정도전 정말 캐스팅부터 기대됩니다. 초심잃지말고 잘 만들어 주시기를 부탁드립니다. 정통 사극 정말 기다렸던 사람들을 대표로 감사드립니다.,2014-01-07,10.0,zpxuefds,63553
.....,2014-01-07,0.0,meinan1,63553
정도전 재밌음.캐스팅 좀 짱인듯...,2014-01-07,10.0,10514혜정,63553
시작부분 굿잡 완전 재밌음,2014-01-07,10.0,hush_913,63553
요즘 영화가 많아서 그런가 캐스팅얘기 자꾸 하시는데캐스팅보다 드라마 자체에 포커스좀 맞춰서 평가해주세요한국드라마보면서 감동받기는 처음입니다.,2014-01-07,10.0,대가리,63553
정도전. 뿌리깊은 나무가 가장 조명을 잘했다고 봄. 이 드라마는 그냥 올드해~ 진부하다고~,2014-01-07,3.0,이스마엘,63553
2회까지 잘봤습니다. 오랫만에 정통사극에 가까운 사극 본거 같아요. 앞으로도 잘 만들어 주세요,2014-01-07,9.0,wlskek,63553
"굿잡!!!저역시 기대가 큽니다.
화이팅하세요!!!",2014-01-07,9.0,샤프가이,63553
대왕의 꿈같은 역사적 매국노인 김춘추를 영웅화한 드라마혹은 타방송사의 매국노찬양드라마인 기황후보단 백배좋네요^^,2014-01-07,10.0,코딱지욜라파기,63553
진정한 사극다운 사극이군요! 가볍게 로맨스사극을 보면서 재밌지만 아쉬운마음도 컷는데 좋습니다! 정통사극!!!,2014-01-07,10.0,잠온다zz,63553
시작은 좋네요.,2014-01-06,10.0,낮은속삭임,63553
"애들 장난같은 ""요""자 들어가는 반말 사극 보다 정통사극보니 무지 반갑습니다. 역시 연기는 중견배우들이 있어야 무게감도 있고 격이 사는듯 합니다.",2014-01-06,10.0,gz,63553
큰기대 큰실망,2014-01-06,0.0,gus,63553
와 지렷다............... 지렷어........ 꿀잼,2014-01-06,10.0,우마,63553
초반에 잘가다가 아역 이야기로 넘어가는건 아니겠지,2014-01-06,8.0,안티프라민,63553
포먼짱,2014-01-06,10.0,잠돌이형,63553
진짜 잘만들었어요!!끝까지 잘만들어 주세요!!,2014-01-05,10.0,slkdg,63553
기대됩니다,2014-01-05,10.0,띵꼬,63553
오랜만에 제데로된 정통사극 나왔네요. 배우들 연기도 아주 좋고무조건 추천입니다 ^^,2014-01-05,10.0,수지v,63553
괜찮네용!!,2014-01-05,10.0,러뷰,63553
"광개토대왕보고 KBS대하사극도 끝날줄알았는데 이제서야 사극다운 사극을 보는것같다. 
출연진도 완전 쩐다 기대가크다~",2014-01-06,10.0,탑골공원물주먹,63553
용의 눈물 같은 정통 사극이 너무 그리웠는데 17년만에 사극 다운 사극을 보며 정말 재미있게 시청하고 있습니다. 정통 사극이 무엇인지 확실히 보여주세요!! 응원하겠습니다.^^,2014-01-06,10.0,사천읍출신,63553
멋지네요. 역사를 돌아볼수 있게되는 시간,2014-01-06,10.0,twlight,63553
출연진들이 개쩌는구나..사극계의 슈퍼히어로들 총집합이네..모처럼 진짜 정통사극....,2014-01-06,10.0,나야나,63553
응답하라 1994 이후에 오랬만에 좋은 드라마가 나왔네요. 사극에서 치열하게 살아가는 인생을 배웁니다. 고려시대나 지금이나 인간의 본성은 똑같아요,2014-01-06,10.0,좋은나라,63553
좋은드라마 같아요.  보고싶어 지는 드라마,2014-01-06,5.0,누나별현중,63553
