comment,date,score,user,title
중국 사극에는 못미치지만 한국 드라마 치고는 상당한 명작인듯 용의눈물 태조왕건 명성황후 등과 어깨를 나란히 할수 있을 정도로,2014-06-17,8.0,브록래스너,63553
좀 지겹다,2014-06-16,2.0,크리스마스,63553
"정점에 오른 사람에겐 내려오는 길만 남은건가..? 그 옛날의 이닌임과 최영장군처럼 외로워보이던 정도전의 모습에다, 이성계와 대면하던 이색대감의 마지막 장면도 참 인상적이었고... 매주 거르지않고 챙겨보던 드라만데, 종영이 다가온다는 게 너무 아쉽다.",2014-06-15,10.0,ㅇㅎㅇ,63553
최고의 드라마,2014-06-15,10.0,dhdhdh,63553
마무리가 어떻게 될지 정말 궁금하네요.. 포커스는 정도전이니 이방원이 3대로 앉으면 막을 내리려나... 정도전의 사병혁파를 반대하는 이방원도 나중에 왕위에 올라서는 똑같이 혁파하는데.. 권력이라는게 참...ㅋㅋ,2014-06-15,10.0,Jimmy,63553
재밌게 보고 있습니다.극 중 59세의 정도전이 너무 정정한 듯.검은 수염?,2014-06-15,10.0,주사광신도 박살,63553
나중에는 이방원이가 정도전 쥑익삐고 왕의 자리 차지함,2014-06-15,10.0,mild,63553
수작중에 수작임,2014-06-14,10.0,아끼야,63553
기되되는구만기래,2014-06-14,10.0,giva1234,63553
2% 부족한 감이 있다.,2014-06-11,7.0,역전의 도원수,63553
역대급 드라마. 역대급 연기자들,2014-06-11,10.0,후레키,63553
한국 드라마 중에 역대급,2014-06-10,10.0,브록래스너,63553
"TV 보고 AIIEH로 다시 보고 ... 이인임, 최영, 정도전 등 연기의 신들의 전쟁, 통찰력 있는 대사들....그런데 조선 개국이후 긴장감이 좀 떨어진 듯....  이런 드라마라면 TV 수신료 인상도  수긍하게 하는....좋은 드라마를 만들어 주는 제작진에 감사함.",2014-06-09,10.0,leemr1001,63553
진심 한국 사극 치고 역대급인듯 대사도 좋고 캐릭성도 좋고 배우들도 너무 멋짐,2014-06-09,10.0,브록래스너,63553
왕좌의 게임보다 더 재밌는 국내사극드라마를 이렇게 빨리보는날이 올줄이야. 웰메이드가 뭔지 제대로 느낀다. 최고의 드라마,2014-06-09,10.0,구구콘,63553
너무 재미짐,2014-06-08,10.0,별별생각,63553
조아조아~~,2014-06-08,10.0,마니팡,63553
"안재모(정안군 역할) 목소리, 눈빛 연기 최고예요~ 시간가는 줄 모르고 봅니다",2014-06-08,10.0,홍랑,63553
20회 까지 보고 적는데 . 솔직히 많이 늘어지고 . 2회 분량을 1회 분량으로 해야 스토리 전개상 재미 붙을 듯.. (강산풍우정이랑 포멧 비슷함..)그리고 지략 싸움을 더 화끈하게 했으면 좋겠음. . ! 다음회가 기대가 안됨 ㅡㅡ;,2014-06-08,7.0,dㅡㅡb,63553
점 점 더 흥미진진해져 가는 느낌...........ㅎ~,2014-06-08,10.0,방아,63553
정도전보고 뿌리깊은나무 보면되겠네....밀본...우리 정도전선생.....,2014-06-29,10.0,황해,63553
ㅆㅅㅌㅊ,2014-06-29,10.0,Grunge Rock,63553
"삼봉, 이제 됐네. 자넨 할 만큼 했어 <- 이거 최고",2014-06-29,10.0,추국현,63553
사극 선수들 총출동 드라마,2014-06-29,10.0,딥임팩트,63553
진정 최고의 드라마다 ㅎ,2014-06-29,10.0,roxyzzang,63553
아쉽다 아쉬워.....대업이 코앞인데...,2014-06-29,10.0,농부의야참,63553
"현재 정도전이 바라는 민본의나라가 되었는데도 나라가 개판일세!!!!지금이나라에 필요한인물은 이방원,박정희, 전두환이다....",2014-06-29,10.0,개쩌는카리스마,63553
이렇게 마무리가 되는구나... 근 7개월동안 정도전때문에 주말이 즐거웠는데... 벌써 아쉽다. ㅎ;;,2014-06-29,10.0,ㅇㅎㅇ,63553
정말 최고의 명작!!!!!!!!!!!!!!!!!!!!!!!!!!!!!!!!!!!!!!!!!!!!!!!!!!!!!!!!!!!!!!!!!!!!!!!!!!와 진짜 근래 들어 추노 이후로 이렇게 잼있는 사극이 만들어질 줄이야 진짜 최고였습니다.너무 잼있게 봤어요!,2014-06-29,10.0,섬광처럼,63553
정말 최고.... 명작이네요. 실감나요,2014-06-29,10.0,rosa-0718,63553
정도전이 꿈꾸는 민본의 세상.. 아이러니 하게도 이방원의 아들인 세종 시대에 빛을 발하지요. 지속되진 않지만....,2014-06-29,10.0,passpass,63553
시청률 20% 넘자 홧팅!!!,2014-06-29,10.0,이은주,63553
오늘이 마지막회...너무 아쉬워요..ㅠㅠ..어제의 그 긴장감은 최고...,2014-06-29,9.0,몬내,63553
"어려서 나에게 존경하는이를 물으면 얼버무렸지만
지금은 누군지 선명히박혔다!
혁명 으로 이루어진 민이본이되는 모든백성이현자인나라를
꿈꾸었던 우리선조 너무나 자랑스럽고
서울거리를 걸을때마다 느껴지는 그의발자욱
그러나 현실은 어떠한가?일본에게 짓밟히고 우리에게
과연 해방이있었는가
리셋!대한민국을꿈꾸며",2014-06-29,10.0,캣코이,63553
"정도전이 요동정벌을 마무리 지었으면 하는 간절한 바램이 있지만.. 뭐, 어쩔 수 없죠.. 역사의 사실이 그러한걸..ㅜㅜ 다른 생각을 해봅니다.. 처음부터 신덕왕후가 이방석이 아닌 이방원을 세자로 책봉하였더라면.. 애당초 왕자의 난도 없었지 않았을까.. 무고한 희생들까지도...",2014-06-29,10.0,Jimmy,63553
이제 마지막 ㅜㅜ 다들 수고 많으셨습니다.계속 보고 싶은데 ㅜㅜ,2014-06-29,10.0,티엔,63553
ㅜㅜ 벌써 정도전 마지막회 ㅜㅜ,2014-06-28,10.0,황해,63553
픽션은 픽션일뿐. 사극같은거 할땐 방송사들이 철저하게 픽션은 픽션이라고 적어놓고 했으면 함. 나라판 년놈들이 갑자기 정의의사도가 되거니 하는일이 없게끔 ㅇ,2014-08-02,0.0,diablo3333,63553
정도전짱!!,2014-08-01,10.0,최강삼성,63553
뒤늦게 정주행 중...,2014-07-31,10.0,jskim,63553
이 드라마 마지막회 보고 많이  울었다.특히 정도전이 죽는 장면에서.눈물이....................나왔다.,2014-07-04,10.0,lovejelly,63553
일단 별점 10개주고...어제 해투에서 정도전배우나온거 보고...잼있다는 추천을받아. 내일부터 정도전 아이들과 함꼐...하루에 한편씩 보기로 했음.. 기대됩니다.,2014-07-04,10.0,박미선,63553
아쉽다 ..... 더 하지 ㅜㅜ,2014-07-04,10.0,H-qualite,63553
주둥이로는 백성을 찾지만....현재 대한민국은 악의축 새누리가 집권하고 있다....작가도 오죽했으면 새누리 보좌관을 했을까!!!....정현민 작가에게 진심으로 묻는다....새누리 보좌관 꼬리는 그대 인생에서 오점인가 정점인가...당신이 반성하지 않는 한..그대의 글과 행동은 삐걱거리고 있음을 알라!!...거짓말쟁이!!,2014-07-04,0.0,후앰아이후아유,63553
이제 정도전 끝나면 무슨 낙으로 주말을 기다리나..  한동안 TV 안볼듯하다 ㅠㅠ,2014-06-28,10.0,가슴에품은 열정,63553
"""삼봉. 이제 그만 됐네. 자넨 할만큼 하였어.""참.. 심금을 울리는군요.",2014-06-28,10.0,passpass,63553
유동근 조재현 박영규 임호 안재모 등 배우들 연기가 너무 좋음 특히 유동근은 너무 멋있다 근데 중국사극에는 못미치는듯,2014-06-28,8.0,브록래스너,63553
정몽주와 정도전의 우애와 결별이 드라마의 하이라이트인듯 정도전 없는 정몽주나 정몽주 없는 정도전이나 반쪽에 불과한듯 ㅎㅎ,2014-07-25,9.0,주완아빠,63553
생각해보면 동아시아 역사에서 왕은 황제의 신하이고 황제의 봉토를 다스리는 지방행정관일지도 모른다고 생각하는데 이런점들로 보아서 한국은 중국의 속국이나 제후국이였을지도 모르겠다,2014-07-24,8.0,쥬도산,63553
정도전은 그저 사극으로서 재미만 주는 것이 아니라 현재의 대한민국 정치의 잘못된 점을 꼬집는 우리의 효자손 같은 역할을 했다고도 본다 이걸 보면서 한 대사 한 대사가 마음에 남았다 이걸 보면서 재미요소가 없다고 하면 그건 정통사극을 볼 줄 모르는 자들의 말이다,2014-07-23,10.0,지구아이,63553
재밌게 본 정통사극... 연기도 좋았고.. 조선건국의 이성계와 정도전 다시 생각케해주는 드라마였습니다..,2014-07-21,10.0,을불공,63553
본방 사수 못한게 아쉽기만 하네요 ^^   잘 봤습니다,2014-07-20,10.0,duftlagltkfwk,63553
백성을 위한? 개뿔 무슨 백성을 위해서..권력을 잡는데 ㅉㅉ드라마는 그냥 드라마로 보면 된다지만 그래도 사극을 그따위로 만들면 되겠냐??,2014-07-12,2.0,백설기,63553
정말 잼나는 정통사극! 사이비 퓨전사극 따위는 보지 않는다... 난 전통사극만 본다!,2014-07-11,9.0,착하게살자,63553
정도전  조재현은 깜이 안됨  연극만 하시길,2014-07-10,9.0,smfrdmsdl,63553
완전 잼 있었어요!!! !!!  정도전 (조재현) 아저씨♥♡~  연기 명품!! 대 상 꼭 타 길!!,2014-07-07,10.0,이혜화,63553
the best,2014-07-06,10.0,wbsdh5,63553
민본,2014-07-06,10.0,Rusifua,63553
끝이라니 너무 아쉽네요ㅠ 앞으로도 좋은 명품 사극들 많이 기대합니다!,2014-07-06,10.0,newera,63553
요새 한드 중에 최고인듯,2014-07-04,8.0,윤종묵,63553
더 보고 싶다. 50회는 너무 짧아.. ㅠㅠ,2014-07-04,10.0,후앙뿌쏀,63553
태조 왕건이후 최고의 사극,2014-07-02,10.0,tosa,63553
삼봉 슨생~~~그동안 고생 많이 했찌비,2014-07-02,10.0,스콜피온,63553
최고의 사극!,2014-07-02,10.0,케이,63553
2014년은 정도전을 시청할 수 있었던 것만으로도 의미있는 해였다.,2014-07-01,10.0,Wasd,63553
킬방원 포스 ㄷㄷ,2014-07-01,10.0,명박산성ㅋ,63553
"용의눈물부터 kbs사극을 집안에서 반강제로 시청을 강요하여 보고 있는 사람인데이번 정도전은 특히 kbs만의 사극의 틀을 뒤짚어 까버린 시원한 전개였다.내용전개, 시청자의 몰입도, 반전엔딩까지 !! 그리고 후에 남는 시청자들만의 후감kbs사극은 한층더 성장했다. 이제 어느 사극도 kbs를 따라잡지 못한다.",2014-07-01,10.0,thets,63553
역시 사극은 kbs지... 유동근 조재현 박영규 안재모 임호 그외 많은 연기신들 정말 수고하셨어요!!! 정도전 후속이 기대됩니다^^,2014-07-01,10.0,가라오케파괴단,63553
정도전의  민본정치이념  시대를 넘어 길이 빛나리라!,2014-07-01,10.0,길마재,63553
정몽주를 죽이고도 이성계 잘못이라고 하고 정도전을 죽이고도 정도전 이성계가 잘못해서 이렇게 되었다고 남탓만 하는 이방원은 자기 책임감이라는게 있는 사람인가? 결국 명분없이 사람을 죽여서 강탈한 용상의 권위를 유지하는 방법은 더 많은 사람을 죽이는 것이었다. 이방원식 왕권정치는 이제는 북한에나 있다.,2014-07-01,10.0,FreeDiver,63553
이 난세에 그리워할 인물이어라...,2014-07-01,10.0,tanquam homo Dei,63553
정도전 작가님이 다음 작품도 써주었으면 좋겠다  정말 기대되는 작가이고 인정하는 작가로 그동안 감사했습니다 ㅎ,2014-07-01,10.0,가슴에품은 열정,63553
"공부는 안하고 드라마로 역사를 배우니 나라가 이꼴이지.. 정도전, 이성계 얘네들은 그냥 권력잡을려고 지랄한건데.. 백성 어쩌구 는 다 개소리임. 정도전은 왕권 견제하는 신권강화 할려고 한것뿐. 그이상 그이하도 아님. 진짜 백성을 생각했으면 적어도 입헌군주제는 갔어야 되는데",2014-07-05,5.0,간디,63553
진짜 최고 다보고와서 평점적어요ㅜㅜ,2014-07-05,10.0,shon,63553
진짜 최고 다보고와서 평점적어요ㅜㅜ,2014-07-05,10.0,shon,63553
다좋은데  뜬금없이 전투신에 액스트라가 무협영화 찍는 장면은 좀빼자 손발이 오글거림,2014-07-05,6.0,비타민,63553
이제 하나씩 보려고,2014-07-05,10.0,jskim,63553
정말 재미있게 보았습니다. 간만에 보는 명품 사극이었습니다. 정도전이 마지막 과업으로 추진했던 요동정벌은 사병 혁파를 위한 정치적인 쇼로 생각됩니다. 설령 요동을 정벌하고 지배력을 행사했더라도 이후 명나라에 영락제가 즉위하고 과연 온전히 지켜낼 수 있었을지 의문이 듭니다,2014-06-30,10.0,둥글둥글,63553
"최고의 사극!
너무 짧다. 용의 눈물, 불멸의 이순신은 100회를 훌쩍 넘어 가는데..
매주 기다리고 끝날까봐 곁눈질로 시계보먼서 보았네요.
고맙습니다♥",2014-06-30,10.0,제우스,63553
ㅠㅠㅠㅠㅠ,2014-06-30,9.0,몬내,63553
픽션은 픽션일뿐. 사극같은거 할땐 방송사들이 철저하게 픽션은 픽션이라고 적어놓고 했으면 함. 나라판 년놈들이 갑자기 정의의사도가 되거니 하는일이 없게끔 ㅇ,2014-08-02,0.0,diablo3333,63553
정도전짱!!,2014-08-01,10.0,최강삼성,63553
뒤늦게 정주행 중...,2014-07-31,10.0,jskim,63553
정몽주와 정도전의 우애와 결별이 드라마의 하이라이트인듯 정도전 없는 정몽주나 정몽주 없는 정도전이나 반쪽에 불과한듯 ㅎㅎ,2014-07-25,9.0,주완아빠,63553
조아조아~~~ 진짜 재밌다~~~,2014-06-30,10.0,이은주,63553
"정말 이런 작품을 이런 시기에 만나게 되어 다행입니다. 창작 지망생으로써 연출, 이야기, 대사 등 모든 것에 있어 많은 것을 배워갑니다. 마지막화를 본 지금은 브금만 들어도 눈물이 배어나올 지경이네요 ㅠㅠ...",2014-06-30,10.0,-_-짜증나,63553
주말마다 기다리면서 1회부터 50부까지 다 봤네;;; 이런 사극좀 많이 좀 만들어 주쇼.,2014-06-30,9.0,우경,63553
별점 돋네 ㅋㅋㅋ그냥 단순한 킹메이커로 알고 있었던 정도전을 다시 돌아보게 된 계기,2014-06-30,10.0,conandoil34,63553
"훌륭한 각본과 세밀한 연출, 배우들의 혼신의 열연이 이런 멋진 작품 만들었다고 생각합니다. 한 회도 빼놓지 않고 보면서 정도전이 꿈꾼 세상은 지금도 계속 온 국민이 꿈꾸고 있다는 생각입니다. 이런 훌륭한 작품, 삼박자가 맞는 작품을 1년에 두번만이라도 보고싶습니다.",2014-06-30,10.0,바다,63553
"이성계는 조선의 몸이라면 정도전은 조선의 머리 즉 조선의   건국사상의 기틀을 마런한  선구자로서 드라마에서는  정도전정몽주 하륜 이성계 이방원 권근 이색  이숙번등  사나이들의  의리 배신 음모 권력싸움등  인생사가 잘 나타난 역사드라마다
배우들의 연기력이 압권",2014-06-27,8.0,콩콩이,63553
생각해보면 동아시아 역사에서 왕은 황제의 신하이고 황제의 봉토를 다스리는 지방행정관일지도 모른다고 생각하는데 이런점들로 보아서 한국은 중국의 속국이나 제후국이였을지도 모르겠다,2014-07-24,8.0,쥬도산,63553
정도전은 그저 사극으로서 재미만 주는 것이 아니라 현재의 대한민국 정치의 잘못된 점을 꼬집는 우리의 효자손 같은 역할을 했다고도 본다 이걸 보면서 한 대사 한 대사가 마음에 남았다 이걸 보면서 재미요소가 없다고 하면 그건 정통사극을 볼 줄 모르는 자들의 말이다,2014-07-23,10.0,지구아이,63553
재밌게 본 정통사극... 연기도 좋았고.. 조선건국의 이성계와 정도전 다시 생각케해주는 드라마였습니다..,2014-07-21,10.0,을불공,63553
본방 사수 못한게 아쉽기만 하네요 ^^   잘 봤습니다,2014-07-20,10.0,duftlagltkfwk,63553
백성을 위한? 개뿔 무슨 백성을 위해서..권력을 잡는데 ㅉㅉ드라마는 그냥 드라마로 보면 된다지만 그래도 사극을 그따위로 만들면 되겠냐??,2014-07-12,2.0,백설기,63553
정말 잼나는 정통사극! 사이비 퓨전사극 따위는 보지 않는다... 난 전통사극만 본다!,2014-07-11,9.0,착하게살자,63553
정도전  조재현은 깜이 안됨  연극만 하시길,2014-07-10,9.0,smfrdmsdl,63553
완전 잼 있었어요!!! !!!  정도전 (조재현) 아저씨♥♡~  연기 명품!! 대 상 꼭 타 길!!,2014-07-07,10.0,이혜화,63553
the best,2014-07-06,10.0,wbsdh5,63553
민본,2014-07-06,10.0,Rusifua,63553
끝이라니 너무 아쉽네요ㅠ 앞으로도 좋은 명품 사극들 많이 기대합니다!,2014-07-06,10.0,newera,63553
"공부는 안하고 드라마로 역사를 배우니 나라가 이꼴이지.. 정도전, 이성계 얘네들은 그냥 권력잡을려고 지랄한건데.. 백성 어쩌구 는 다 개소리임. 정도전은 왕권 견제하는 신권강화 할려고 한것뿐. 그이상 그이하도 아님. 진짜 백성을 생각했으면 적어도 입헌군주제는 갔어야 되는데",2014-07-05,5.0,간디,63553
진짜 최고 다보고와서 평점적어요ㅜㅜ,2014-07-05,10.0,shon,63553
진짜 최고 다보고와서 평점적어요ㅜㅜ,2014-07-05,10.0,shon,63553
간만에 명품 드라마 였습니다.,2014-06-30,10.0,paragon74,63553
결국 삼봉은 나를 잊지 말아달라던 양지와의 약속을 끝까지 지켰군요~,2014-06-30,10.0,창중사랑,63553
역사책 스포때문에 다알고있었음에도 연출을 너무잘했고 연기력도 멋졌다... 개인적으론 쭉이어서 세종까지 달려서 초대하드라마 찍어버리길 바랬다 ㅋㅋㅋㅋ,2014-06-30,10.0,참소주,63553
결말을 미리 알고도 이렇게 슬플 수가 있구나.. 눈물이 찔끔 났다.,2014-06-30,10.0,몬,63553
어제는 너무나 슬프게 끝났다 이드라마 얼마나 슬프던지 모른다 특히 정도전이 죽을때 더 많이 슬펐다.,2014-06-30,10.0,giva1234,63553
조재현의 명연기에 첫회부터 애청했습니다.,2014-06-30,10.0,다나,63553
보지않았다면 후회했을것이다 진정한 이시대의 명작,2014-06-30,10.0,클레멘타인,63553
시즌2를 기대한다..과거의 역사가 아닌 미래의 픽션이라도...,2014-06-30,10.0,바우,63553
내인생최고의드라마,2014-06-30,10.0,트롤퉁퉁퉁가,63553
삼봉을 보내지 못해 이 시간에도 잠 못 이룹니다.,2014-06-30,10.0,알렉세이,63553
남은의 비장하고 의리있는 최후의 모습이 너무나 인상깊고 멋있었습니다 훌륭하고 가슴 뭉클한 연기에 감사드립니다 ㅠㅠㅠㅠㅠ,2014-06-30,10.0,가슴에품은 열정,63553
역대급 역사드라마,2014-06-30,10.0,김지은,63553
정말 잘 봤습니다. 오랜만에 가슴이 뜨거워지는 드라마였어요.,2014-06-30,10.0,별별생각,63553
한국 요새 드라마 중에선 최곤데 중국 사극을 봐서 눈이 높아져서 그런지 그렇게까지 대단해보이진 않음 하지만 유동근은 너무 멋있다,2014-06-27,7.0,브록래스너,63553
정도전화있띵,2014-06-26,10.0,giva1234,63553
"이방원으로 인해 중국에 대한 사대가 더 강화되었습니다.알아서 갖다 바쳤다는.. 울 백성도 주원장이 송환하라는 것보다 몇배를 중국으로 송환했다고 하더군요.무엇보다 역사적 사실을 객관적인 시각으로 본 점도 높이 평가하고 싶고 한국에서 연기 잘하는 배우들을 다 모아 놓아서 더 좋았어요..유동근, 조재현..",2014-06-26,10.0,님프,63553
이성계를 미화하는것만 빼고는 최고인듯!,2014-06-25,9.0,Rock This Room,63553
진심 짱이다ㅎㅎ,2014-06-25,10.0,ksy8589,63553
송헌과 삼봉의 의리! 드라마가 미친듯하다. 차원이 다른 재미. 끓어오르는 무언가가 느껴진다.,2014-06-25,10.0,섬광처럼,63553
"역사적 사실을 기반으로 했다지만 작가가 정말 대단하다는 말밖에 안 나온다. 
대사 하나하나가 주옥이고 주조연 누구 한명  연기가 대단하다.",2014-06-25,10.0,물음,63553
위화도회군을 단행한 정도전이나 북벌에 반대한 이방원이나 그놈이 그놈이지무슨 정도전이 잘낫다고.....주원장이 정말 한반도를 좌지우지하는 기술이 탁월합니다 그려,2014-06-24,9.0,날참새,63553
너무나 재미있다.,2014-06-24,10.0,giva1234,63553
꿀잼^^,2014-06-24,10.0,Queenie,63553
너무 재미있어서~정도전을 안 보면 화를 낸다는...ㅋㅋ,2014-06-23,10.0,맥반석오징어,63553
너무잘보고있다.,2014-06-23,10.0,giva1234,63553
요즘은 사극이 지루하지만 초반에는 볼만하다.,2014-06-23,10.0,서창용,63553
"최수종 않나와서 다행
그리고 박영규가 드라마 살린거다",2014-06-22,10.0,오라잇,63553
다좋은데  뜬금없이 전투신에 액스트라가 무협영화 찍는 장면은 좀빼자 손발이 오글거림,2014-07-05,6.0,비타민,63553
이제 하나씩 보려고,2014-07-05,10.0,jskim,63553
good,2014-06-29,10.0,wbsdh5,63553
끝이라니..ㅜ,2014-06-29,10.0,숨어푸,63553
보면 볼수록 정도전의 죽음과 요동정벌에 대한 펼치지 못한 꿈이 너무도 가슴아프게 안타깝다,2014-06-22,10.0,가슴에품은 열정,63553
재밌네,2014-06-22,9.0,엑스스포츠,63553
이방원이땜에 사대주의가 더욱 뿌리박히는구나...요동 ㅏㄱㅆ어야했는디...이성계가 위화도 회군했으니 이젠 갔어야지...지하에계신 최영장군이 운다 울어,2014-06-22,10.0,개쩌는카리스마,63553
요새 드라마 중에 최고 유동근 박영규 너무 멋짐,2014-06-20,9.0,브록래스너,63553
유동근이 너무 멋지다 작품 자체도 훌륭한데 유동근이라는 배우 자체도 너무 멋있음 용의눈물 이방원 명성황후 대원군 정도전 이성계 까지 암튼 유동근은 너무 멋짐,2014-06-19,10.0,브록래스너,63553
나름 괜찮은 사극인줄 알았는데 주원장을 너무 비하 하는거 같다 중국이 대국이 맞고 한국이 소국이 맞는건데 주원장이 이성계를 두려워한다는 어이 없는 개소리를 짓거린다는거 자체가 좀 이해가 안간다,2014-06-07,6.0,브록래스너,63553
ㅋㅋㅋㅋ개역적이랰ㅋ,2014-06-07,9.0,실실이,63553
"풋,개역적?ㅋ",2014-06-07,10.0,예수님아들,63553
지금 KBS에서 마음에 드는 프로그램은 이것 뿐.,2014-06-06,10.0,knuckleball,63553
모두들 힘내세요~~!!!,2014-06-04,10.0,아기사랑,63553
아무리 그래봐야 개역적들~~~~~~~~~~~~~~ㅋㅋ,2014-06-04,7.0,귀농,63553
"정통사극은 k본부이지만..... 역시 인물들의 성격 등 역사적 사실관 약간 다름...그러나 젊은이들이 역사에 관심갖게 되는 작품이면 이 나라에선 그걸로 족함...그 체계에 맞춰 가르쳐야만 하는 역사 선생님의 가르침을 맹신하는 것도 문제지만, 드라마를 너무 맹신 하시진 마시길....",2014-06-03,10.0,쿨쿠루루,63553
최고의  출연진  최상의  연기력 어제 성계탕 먹으며  눈물 흘리던  태조의 모습에  나도같이 눈물이~~~역시 구관이 명관이란 말이 이런걸 두고 하는 말인듯,2014-06-02,10.0,하트,63553
최고 최고 정말 최고의 사극드라마..50대 아줌마가 열열히 지지합니다.~!!,2014-06-02,10.0,홍랑,63553
굿입니다!!!!!!!!!!!,2014-06-02,10.0,하늘아래산다,63553
배우들 연기 보는 재미도 있고 역사도 배우고 요즘 드라마중 단연 최고!,2014-06-02,10.0,노홍철시러,63553
성계탕씬에서 나 울뻔했다 ㅜㅜ연기가 너무좋아.... 굿.....,2014-06-02,10.0,황해,63553
성계탕 먹으면서 우는 유동근 연기 보고 할말을 잃었다.. 같이 울컥.. 어떻게 연기가 저렇지? 저게 어떻게 가능하냐고.. 볼때마다 놀란다..,2014-06-01,10.0,shining star,63553
오늘은 세자자리를 놓고서 다투는 날이구만 기래,2014-06-01,10.0,giva1234,63553
와 진정 이 시대엔 정도전이 필요하다.손에 피를 묻히더라도 백성들이 사람답게 사는 나라를 만들어줄 그런 영웅,2014-06-01,10.0,근육맨이되자,63553
기존 사극에선 볼 수 없었던 사투리 연기와 이성계의 인간적인 모습들....어제 육포를 먹으며 맛있다고 하면서 정도전에게도 하나 먹어보라는 장면 아 넘 참신하고 좋았습니다 ㅎㅎ,2014-06-01,10.0,내생에대박,63553
참여하고 있는 모든 사람들이 혼신의 힘으로 만들어가고 있음을 매회 느끼게 하는 드라마.. 볼 때 마다 전율이 흐른다.,2014-05-29,10.0,싱어송,63553
이게 바로 TV 보는 맛이지...,2014-05-29,10.0,메이트,63553
요 근래에 명작이 아닐까 싶다,2014-05-29,10.0,꼬부기,63553
토일 꼭 보겠구마,2014-05-28,10.0,giva1234,63553
용의눈물에서 정도전만 부각시킨 용의눈물2 구만....................봐줄만은한데..너무 똑같어 유동근만 방원에서 성계로 바뀌었고....앞으로 중전 죽고 민씨죽도 정도전죽고 민씨동생주고 쭉~~다~~죽어~~~ㅋㅋ이방원도 참 대단한 놈 ㅋ,2014-06-01,7.0,귀농,63553
"""백성은 국가의 근본인 동시에 군주의 하늘이다""  미천하고 무지한 백성으로만 보던 시대에 저런 생각을 하는 사람이 있었다는것만으로도 놀랍고, 현 시대가 어수선해서인지... 뭔가 위로가 된다.",2014-05-31,10.0,푸른하늘,63553
길환영물러가라!!! 50부가 웬말이야!!! 웬말이야!!!드라마 연장해라!!! 연장해라!!!,2014-05-30,10.0,오스틴,63553
최고의 드라마,2014-05-30,10.0,우람이,63553
최고,2014-05-28,10.0,INUYASHA,63553
